{
  "schema_version": "1.0.0",
  "record_type": "SOURCE_ONLY_DOMAIN_PACK_CATALOG",
  "operational_status": "NO_GO",
  "shared_capability_ids": [
    "OBJECTIVE_INTELLIGENCE",
    "CUSTOMER_CASES",
    "OPERATIONS",
    "FINANCE_VALUE",
    "CONTENT_DOCUMENTS",
    "DECISION_INTELLIGENCE",
    "ORCHESTRATION",
    "ANALYTICS_MEASUREMENT",
    "SECURITY_GOVERNANCE",
    "PLATFORM_EXTENSION"
  ],
  "extension_contract": {
    "industry_count_limit": null,
    "accepts_new_sector_ids": true,
    "requires_source_review": true,
    "required_server_side_admission": true,
    "production_enabled": false
  },
  "profiles": [
    {
      "id": "sales_customer_service",
      "label": "Sales & Customer Service",
      "sector_group": "Commercial",
      "status": "DESIGN_ONLY",
      "enabled": false,
      "production_ready": false,
      "risk_tier": "ELEVATED",
      "use_cases": [
        "Organize customer inquiries and follow-up decisions"
      ],
      "capability_refs": [
        "OBJECTIVE_INTELLIGENCE",
        "CUSTOMER_CASES",
        "CONTENT_DOCUMENTS",
        "ORCHESTRATION",
        "SECURITY_GOVERNANCE"
      ],
      "data_exclusions": [
        "live customer identity, conversations or contact details"
      ],
      "required_reviews": [
        "IDENTITY_TENANT",
        "SECURITY_ACCEPTANCE",
        "HUMAN_APPROVAL",
        "MEASUREMENT_BASELINE",
        "DATA_PROTECTION"
      ]
    },
    {
      "id": "healthcare_administration",
      "label": "Healthcare Administration",
      "sector_group": "Healthcare",
      "status": "DESIGN_ONLY",
      "enabled": false,
      "production_ready": false,
      "risk_tier": "REGULATED",
      "use_cases": [
        "Prepare appointment and administrative intake review"
      ],
      "capability_refs": [
        "OBJECTIVE_INTELLIGENCE",
        "CUSTOMER_CASES",
        "OPERATIONS",
        "CONTENT_DOCUMENTS",
        "SECURITY_GOVERNANCE"
      ],
      "data_exclusions": [
        "patient identities, diagnoses, prescriptions, insurance claims and clinical records"
      ],
      "required_reviews": [
        "IDENTITY_TENANT",
        "SECURITY_ACCEPTANCE",
        "HUMAN_APPROVAL",
        "MEASUREMENT_BASELINE",
        "DOMAIN_SPECIALIST",
        "DATA_PROTECTION",
        "LEGAL_REGULATORY"
      ]
    },
    {
      "id": "real_estate",
      "label": "Real Estate",
      "sector_group": "Property",
      "status": "DESIGN_ONLY",
      "enabled": false,
      "production_ready": false,
      "risk_tier": "ELEVATED",
      "use_cases": [
        "Review property inquiries and viewing scheduling workflows"
      ],
      "capability_refs": [
        "OBJECTIVE_INTELLIGENCE",
        "CUSTOMER_CASES",
        "OPERATIONS",
        "CONTENT_DOCUMENTS",
        "SECURITY_GOVERNANCE"
      ],
      "data_exclusions": [
        "tenant identities, property addresses, contract signatures and live tenancy records"
      ],
      "required_reviews": [
        "IDENTITY_TENANT",
        "SECURITY_ACCEPTANCE",
        "HUMAN_APPROVAL",
        "MEASUREMENT_BASELINE",
        "DATA_PROTECTION"
      ]
    },
    {
      "id": "retail",
      "label": "Retail",
      "sector_group": "Commerce",
      "status": "DESIGN_ONLY",
      "enabled": false,
      "production_ready": false,
      "risk_tier": "ELEVATED",
      "use_cases": [
        "Review stock, replenishment and customer engagement"
      ],
      "capability_refs": [
        "OBJECTIVE_INTELLIGENCE",
        "OPERATIONS",
        "CUSTOMER_CASES",
        "FINANCE_VALUE",
        "SECURITY_GOVERNANCE"
      ],
      "data_exclusions": [
        "customer records, real inventory mutations, charges and payments"
      ],
      "required_reviews": [
        "IDENTITY_TENANT",
        "SECURITY_ACCEPTANCE",
        "HUMAN_APPROVAL",
        "MEASUREMENT_BASELINE",
        "DATA_PROTECTION"
      ]
    },
    {
      "id": "wholesale",
      "label": "Wholesale & Distribution",
      "sector_group": "Commerce",
      "status": "DESIGN_ONLY",
      "enabled": false,
      "production_ready": false,
      "risk_tier": "ELEVATED",
      "use_cases": [
        "Draft stock replenishment and bulk order reviews"
      ],
      "capability_refs": [
        "OBJECTIVE_INTELLIGENCE",
        "OPERATIONS",
        "FINANCE_VALUE",
        "CUSTOMER_CASES",
        "SECURITY_GOVERNANCE"
      ],
      "data_exclusions": [
        "buyer identities, live purchase orders, trade credit and financial transfers"
      ],
      "required_reviews": [
        "IDENTITY_TENANT",
        "SECURITY_ACCEPTANCE",
        "HUMAN_APPROVAL",
        "MEASUREMENT_BASELINE",
        "DATA_PROTECTION"
      ]
    },
    {
      "id": "cloud_it",
      "label": "Cloud & Enterprise IT",
      "sector_group": "Technology",
      "status": "DESIGN_ONLY",
      "enabled": false,
      "production_ready": false,
      "risk_tier": "ELEVATED",
      "use_cases": [
        "Review approved IT cost and reliability questions"
      ],
      "capability_refs": [
        "OBJECTIVE_INTELLIGENCE",
        "OPERATIONS",
        "DECISION_INTELLIGENCE",
        "ANALYTICS_MEASUREMENT",
        "SECURITY_GOVERNANCE"
      ],
      "data_exclusions": [
        "cloud secrets, tenant credentials, production mutations and sensitive telemetry"
      ],
      "required_reviews": [
        "IDENTITY_TENANT",
        "SECURITY_ACCEPTANCE",
        "HUMAN_APPROVAL",
        "MEASUREMENT_BASELINE",
        "DATA_PROTECTION"
      ]
    },
    {
      "id": "transportation",
      "label": "Transportation",
      "sector_group": "Mobility",
      "status": "DESIGN_ONLY",
      "enabled": false,
      "production_ready": false,
      "risk_tier": "ELEVATED",
      "use_cases": [
        "Review fleet capacity, assignment and service delays"
      ],
      "capability_refs": [
        "OBJECTIVE_INTELLIGENCE",
        "OPERATIONS",
        "DECISION_INTELLIGENCE",
        "CUSTOMER_CASES",
        "SECURITY_GOVERNANCE"
      ],
      "data_exclusions": [
        "live vehicle locations, driver identities, passenger details and dispatch writes"
      ],
      "required_reviews": [
        "IDENTITY_TENANT",
        "SECURITY_ACCEPTANCE",
        "HUMAN_APPROVAL",
        "MEASUREMENT_BASELINE",
        "DATA_PROTECTION"
      ]
    },
    {
      "id": "logistics",
      "label": "Logistics & Supply Chain",
      "sector_group": "Mobility",
      "status": "DESIGN_ONLY",
      "enabled": false,
      "production_ready": false,
      "risk_tier": "ELEVATED",
      "use_cases": [
        "Plan shipment exception and capacity workflows"
      ],
      "capability_refs": [
        "OBJECTIVE_INTELLIGENCE",
        "OPERATIONS",
        "ANALYTICS_MEASUREMENT",
        "ORCHESTRATION",
        "SECURITY_GOVERNANCE"
      ],
      "data_exclusions": [
        "live shipment addresses, custody information and tracking identities"
      ],
      "required_reviews": [
        "IDENTITY_TENANT",
        "SECURITY_ACCEPTANCE",
        "HUMAN_APPROVAL",
        "MEASUREMENT_BASELINE",
        "DATA_PROTECTION"
      ]
    },
    {
      "id": "tourism",
      "label": "Tourism",
      "sector_group": "Hospitality",
      "status": "DESIGN_ONLY",
      "enabled": false,
      "production_ready": false,
      "risk_tier": "ELEVATED",
      "use_cases": [
        "Review guest inquiries and itinerary handoffs"
      ],
      "capability_refs": [
        "OBJECTIVE_INTELLIGENCE",
        "CUSTOMER_CASES",
        "OPERATIONS",
        "CONTENT_DOCUMENTS",
        "SECURITY_GOVERNANCE"
      ],
      "data_exclusions": [
        "traveler identity documents, real bookings and payments"
      ],
      "required_reviews": [
        "IDENTITY_TENANT",
        "SECURITY_ACCEPTANCE",
        "HUMAN_APPROVAL",
        "MEASUREMENT_BASELINE",
        "DATA_PROTECTION"
      ]
    },
    {
      "id": "hospitality",
      "label": "Hotels & Hospitality",
      "sector_group": "Hospitality",
      "status": "DESIGN_ONLY",
      "enabled": false,
      "production_ready": false,
      "risk_tier": "ELEVATED",
      "use_cases": [
        "Organize room inventory and guest-service requests"
      ],
      "capability_refs": [
        "OBJECTIVE_INTELLIGENCE",
        "CUSTOMER_CASES",
        "OPERATIONS",
        "ANALYTICS_MEASUREMENT",
        "SECURITY_GOVERNANCE"
      ],
      "data_exclusions": [
        "guest profiles, payment details and live reservations"
      ],
      "required_reviews": [
        "IDENTITY_TENANT",
        "SECURITY_ACCEPTANCE",
        "HUMAN_APPROVAL",
        "MEASUREMENT_BASELINE",
        "DATA_PROTECTION"
      ]
    },
    {
      "id": "education",
      "label": "Education & Training",
      "sector_group": "Education",
      "status": "DESIGN_ONLY",
      "enabled": false,
      "production_ready": false,
      "risk_tier": "REGULATED",
      "use_cases": [
        "Prepare class scheduling and enrollment process review"
      ],
      "capability_refs": [
        "OBJECTIVE_INTELLIGENCE",
        "OPERATIONS",
        "CONTENT_DOCUMENTS",
        "CUSTOMER_CASES",
        "SECURITY_GOVERNANCE"
      ],
      "data_exclusions": [
        "student identities, minors data, grades, payment records and guardianship records"
      ],
      "required_reviews": [
        "IDENTITY_TENANT",
        "SECURITY_ACCEPTANCE",
        "HUMAN_APPROVAL",
        "MEASUREMENT_BASELINE",
        "DOMAIN_SPECIALIST",
        "DATA_PROTECTION",
        "LEGAL_REGULATORY"
      ]
    },
    {
      "id": "manufacturing",
      "label": "Manufacturing",
      "sector_group": "Industrial",
      "status": "DESIGN_ONLY",
      "enabled": false,
      "production_ready": false,
      "risk_tier": "ELEVATED",
      "use_cases": [
        "Evaluate production bottlenecks and maintenance plans"
      ],
      "capability_refs": [
        "OBJECTIVE_INTELLIGENCE",
        "OPERATIONS",
        "DECISION_INTELLIGENCE",
        "ANALYTICS_MEASUREMENT",